{
  "schema_version": "0.1.0",
  "titulo": "Ciclo XVII — Vandar, a cidade que deixou de poder provar seus mortos",
  "estado": "dossie_de_worldbuilding_em_revisao",
  "aprovacao_autoral": false,
  "efeito_canonico_automatico": false,
  "lugar_id": "lugar:vandar",
  "regiao_id": "regiao:eldroth",
  "governante_atual_documentado": "Lorde Damaris Blackthorn",
  "fonte_autoral": "fontes/autoria/hack-carcaca-dw-capitulo-i.paginas.json",
  "atlas_anterior": "data/worldbuilding/eldroth-ironwood-vandar-ciclo14.json",
  "linha_do_tempo": {
    "fundacao_ec": null,
    "queda_ec": null,
    "comeco_dominio_damaris_ec": null,
    "numero_de_mortos": null,
    "numero_de_sobreviventes": null
  },
  "fatos_textuais": [
    {
      "id": "worldbuilding-xvii:fato:prosperidade",
      "fonte": {
        "documento": "fontes/autoria/hack-carcaca-dw-capitulo-i.paginas.json",
        "pagina": 5,
        "sintese": "Vandar outrora era uma cidade próspera.",
        "estado": "fonte_manuscrita_sem_ampliacao"
      },
      "afirmacao": "Vandar foi descrita como cidade próspera antes de sua ruína."
    },
    {
      "id": "worldbuilding-xvii:fato:ruina",
      "fonte": {
        "documento": "fontes/autoria/hack-carcaca-dw-capitulo-i.paginas.json",
        "pagina": 5,
        "sintese": "A cidade foi reduzida a ruínas e se tornou covil de Lorde Damaris Blackthorn.",
        "estado": "fonte_manuscrita_sem_ampliacao"
      },
      "afirmacao": "Vandar encontra-se arruinada e ocupada por Damaris."
    },
    {
      "id": "worldbuilding-xvii:fato:necromancia",
      "fonte": {
        "documento": "fontes/autoria/hack-carcaca-dw-capitulo-i.paginas.json",
        "pagina": 5,
        "sintese": "Damaris comanda exército de mortos-vivos.",
        "estado": "fonte_manuscrita_sem_ampliacao"
      },
      "afirmacao": "O governante das ruínas dispõe de exército de mortos-vivos."
    },
    {
      "id": "worldbuilding-xvii:fato:incursoes",
      "fonte": {
        "documento": "fontes/autoria/hack-carcaca-dw-capitulo-i.paginas.json",
        "pagina": 5,
        "sintese": "As ruínas servem como base de incursões contra regiões ainda não subjugadas.",
        "estado": "fonte_manuscrita_sem_ampliacao"
      },
      "afirmacao": "Vandar tem função estratégica para incursões contra territórios ainda resistentes."
    }
  ],
  "limites": [
    "Não atribuir a Vandar data de fundação, data da ruína, população, área, planta de ruas ou tipo econômico.",
    "Não decidir sem fonte se Damaris causou a destruição original ou tomou a cidade já arruinada.",
    "A existência de mortos-vivos sob Damaris não demonstra que todos sejam ex-cidadãos, que conservem alma ou que possuam identidade.",
    "Nenhum templo, cemitério, cartório, tribunal, arquivo, bairro, moeda, estrutura de governo ou profissão formal é confirmado.",
    "Pessoas reivindicantes e testemunhas são papéis imaginados, não NPCs confirmados, nem residentes atuais de Vandar.",
    "Categorizações de mortos/desaparecidos são instrumentos de debate, não leis existentes nem mecânicas de D&D.",
    "Modelos de ocupação, vinhetas, provas e reconstruções sociais não foram aprovados ou ocorridos.",
    "Não alterar a geografia: Vandar é lugar distinto de Eldroth, ambos pertencentes à região da asa direita; Ironwood não integra Vandar.",
    "Não alterar Damaris ou atribuir o domínio de Vandar a Sylara.",
    "Não alterar as sete criaturas canônicas ou inventar rituais necromânticos concretos."
  ],
  "resumo": {
    "fases": 3,
    "tecidos_urbanos": 8,
    "modalidades_de_prova": 5,
    "situacoes_de_morte": 4,
    "papeis_sociais": 6,
    "modelos_do_dominio": 3,
    "vinhetas": 4,
    "decisoes_pendentes": 8
  },
  "fases": [
    {
      "id": "worldbuilding-xvii:fase:anterior-a-ruina",
      "nome": "Cidade próspera anterior à ruína",
      "ano_inicial_ec": null,
      "ano_final_ec": null,
      "estatuto": "fase_documentada_sem_data",
      "evidencia": {
        "documento": "fontes/autoria/hack-carcaca-dw-capitulo-i.paginas.json",
        "pagina": 5,
        "sintese": "Vandar foi outrora cidade próspera.",
        "estado": "fonte_manuscrita_sem_ampliacao"
      },
      "afirmacoes_permitidas": [
        "Existência de uma cidade considerada próspera.",
        "Houve vida urbana antes da ruína."
      ],
      "nao_deduzir": [
        "Data de fundação.",
        "Tamanho da população.",
        "Forma de governo.",
        "Natureza da prosperidade."
      ]
    },
    {
      "id": "worldbuilding-xvii:fase:ruptura-desconhecida",
      "nome": "Processo não datado de destruição e tomada",
      "ano_inicial_ec": null,
      "ano_final_ec": null,
      "estatuto": "lacuna_historica_explicitada",
      "evidencia": {
        "documento": "fontes/autoria/hack-carcaca-dw-capitulo-i.paginas.json",
        "pagina": 5,
        "sintese": "Vandar foi reduzida a ruína e transformada em covil por Damaris.",
        "estado": "fonte_manuscrita_sem_ampliacao"
      },
      "afirmacoes_permitidas": [
        "A cidade mudou da prosperidade para a condição de ruína.",
        "Damaris ocupa as ruínas."
      ],
      "nao_deduzir": [
        "Um cerco específico.",
        "Uma peste.",
        "A causa e a duração da destruição.",
        "O autor do primeiro ataque."
      ]
    },
    {
      "id": "worldbuilding-xvii:fase:ruinas-ocupadas",
      "nome": "Ruínas usadas por Damaris",
      "ano_inicial_ec": null,
      "ano_final_ec": null,
      "estatuto": "fase_documentada_sem_data",
      "evidencia": {
        "documento": "fontes/autoria/hack-carcaca-dw-capitulo-i.paginas.json",
        "pagina": 5,
        "sintese": "Damaris comanda mortos-vivos e usa as ruínas como base de incursões.",
        "estado": "fonte_manuscrita_sem_ampliacao"
      },
      "afirmacoes_permitidas": [
        "Damaris controla as ruínas e um exército de mortos-vivos.",
        "Há incursões contra terras não totalmente subjugadas."
      ],
      "nao_deduzir": [
        "Origem de cada morto-vivo.",
        "Existência de cidadãos vivos no interior das ruínas.",
        "Estrutura de comando militar detalhada.",
        "Condição atual de cada cadáver."
      ]
    }
  ],
  "tecidos_urbanos": [
    {
      "id": "worldbuilding-xvii:tecido:moradia-e-bairros",
      "nome_editorial": "A cidade onde se morava",
      "dominio": "habitação_e_vizinhança",
      "estado": "pergunta_de_reconstrucao_nao_confirmada",
      "afirmacao_minima_documentada": "Vandar era uma cidade próspera e hoje está em ruínas sob Damaris; a estrutura específica desta dimensão urbana não foi descrita.",
      "pergunta_historica": "Quem possuía casas, quem alugava e quem vivia em espaços comuns?",
      "desdobramento_possivel": "As famílias poderiam exigir reconhecimento do lar mesmo após a destruição do endereço.",
      "risco_de_falsa_precisao": "A lembrança de um bairro pode ser disputada por quem nunca o viu.",
      "limite_documental": "Uma cidade próspera pressupõe vida urbana, mas não confirma tamanho, muralha, bairros nem forma de residência.",
      "fonte_contextual": {
        "documento": "fontes/autoria/hack-carcaca-dw-capitulo-i.paginas.json",
        "pagina": 5,
        "sintese": "Vandar descrita apenas como cidade outrora próspera, hoje arruinada.",
        "estado": "fonte_manuscrita_sem_ampliacao"
      },
      "instituicao_urbana_confirmada": false,
      "edificio_confirmado": null,
      "nome_de_morador_confirmado": null,
      "quantidade_confirmada": null
    },
    {
      "id": "worldbuilding-xvii:tecido:trabalho-e-oficios",
      "nome_editorial": "A prosperidade tinha mãos",
      "dominio": "trabalho_e_producao",
      "estado": "pergunta_de_reconstrucao_nao_confirmada",
      "afirmacao_minima_documentada": "Vandar era uma cidade próspera e hoje está em ruínas sob Damaris; a estrutura específica desta dimensão urbana não foi descrita.",
      "pergunta_historica": "Quem produzia alimento, fabricava objetos, mantinha ruas e executava trabalho pouco reconhecido?",
      "desdobramento_possivel": "Ofícios poderiam transmitir memórias de ruas e ferramentas que mapas oficiais já não guardam.",
      "risco_de_falsa_precisao": "Reconstituir riqueza sem trabalho criaria uma cidade aristocrática sem gente.",
      "limite_documental": "Próspera não significa necessariamente mercantil, agrícola, mineira ou mágica; a base econômica de Vandar não é descrita.",
      "fonte_contextual": {
        "documento": "fontes/autoria/hack-carcaca-dw-capitulo-i.paginas.json",
        "pagina": 5,
        "sintese": "Vandar descrita apenas como cidade outrora próspera, hoje arruinada.",
        "estado": "fonte_manuscrita_sem_ampliacao"
      },
      "instituicao_urbana_confirmada": false,
      "edificio_confirmado": null,
      "nome_de_morador_confirmado": null,
      "quantidade_confirmada": null
    },
    {
      "id": "worldbuilding-xvii:tecido:abastecimento",
      "nome_editorial": "Água, pão e circulação",
      "dominio": "infraestrutura_e_subsistencia",
      "estado": "pergunta_de_reconstrucao_nao_confirmada",
      "afirmacao_minima_documentada": "Vandar era uma cidade próspera e hoje está em ruínas sob Damaris; a estrutura específica desta dimensão urbana não foi descrita.",
      "pergunta_historica": "Quem distribuía água e comida; que trajetos eram usados e quem ficava de fora?",
      "desdobramento_possivel": "Conhecimento de abastecimento pode revelar uma história social que a glória de Vandar oculta.",
      "risco_de_falsa_precisao": "Não criar canal, ponte ou porto por inferência.",
      "limite_documental": "A cidade tinha de sustentar seus habitantes, mas as fontes não identificam fonte de água, importações nem campos.",
      "fonte_contextual": {
        "documento": "fontes/autoria/hack-carcaca-dw-capitulo-i.paginas.json",
        "pagina": 5,
        "sintese": "Vandar descrita apenas como cidade outrora próspera, hoje arruinada.",